{
  "schemaVersion": "shipcheck-acceptance-contract-v1.0.0",
  "contractId": "contract_demo_001",
  "compilerVersion": "shipcheck-compiler-v1",
  "policyVersion": "shipcheck-acceptance-v1.0.0",
  "executionPolicyVersion": "shipcheck-public-web-v1.0.0",
  "target": "https://example.com",
  "createdAt": "2026-07-11T20:00:00Z",
  "requirements": [
    {
      "id": "req_pricing",
      "statement": "A pricing section is present.",
      "provenance": {
        "kind": "BRIEF_SPAN",
        "sourceText": "pricing",
        "start": 36,
        "end": 43
      },
      "class": "EXECUTABLE",
      "priority": "REQUIRED",
      "prioritySource": "DEFAULT",
      "confidence": 0.95,
      "intent": "SECTION_PRESENT"
    },
    {
      "id": "req_modern",
      "statement": "The design feels modern.",
      "provenance": {
        "kind": "BRIEF_SPAN",
        "sourceText": "The design should feel modern",
        "start": 93,
        "end": 122
      },
      "class": "SUBJECTIVE",
      "priority": "REQUIRED",
      "prioritySource": "DEFAULT",
      "confidence": 0.99,
      "clarification": "Provide a reference design or measurable visual constraints."
    }
  ],
  "contractHash": "0000000000000000000000000000000000000000000000000000000000000000"
}
